How can you think that I could do a thing like that ?	1,5,6
The girl you thought you knew was quite nameless and without reality .	1
But you're holding something back .	0
Is he gonna be a problem ?	0,2,6
You know how much I enjoy your high style of playing .	3
( imitates monkey gibbering )	3
Thank God you answered .	3
I admit I was nervous .	2
Why won't you let me help you ?	5
You've been served .	0
Now , I happen to know of a prick that's responsible for the whole fucking operation and that son of bitch is hurting out there , and I'm fucking liking it .	0,1,3
You'll be able to buy ten of these .	3
Your blood will thicken .	0
I must come clean , though . I I had a man in my bed last night .	5
Such spirit ! Catch me if you can !	0
Young man , you think this thing won't fly ?	6
What , do you think I consider it recreation ?	6
Yeah ! Yeah ... Yes !	0,3
Get me a prisoner , understand ?	0
I'd say you were the only man I ever loved .	5
You might choose your company with better taste .	1
I hate him so fucking much .	0
I can't believe it !	0,6
Let's try it again . ♪ There was old man Nemo ♪	3
Well , don't be so mysterious .	0
They're gonna need a fucking wrecking ball to take me out of here .	0
I called and called . - Where were you last night ?	0
Remember my th birthday party when you lifted your skirt up ...	3
Tell the cobbler I am delighted to have it .	3
That is some horse .	6
Who told you to step up on my sneakers ?	1
Looks like a fucking choirboy .	0,1
She's very sick .	5
A lot of firepower .	2
If not , get the fuck off my car !	0
Pleasure meeting you .	3
Take your hands off me !	0
Okay , we have , uh , chamomile , [PERSON] --	6
Shit ! [PERSON]'s got a streamer !	0
Go on , go to work .	0
Are you going to come or do I have to drag you ?	0
She's down .	5
I know this sounds weird ... There's no place I'd rather be .	3
Where is [PERSON] ?	0
I didn't even have time to wash my hair today .	5
I'm gonna leave .	0
I lost my place .	5
A drink comes in pretty handy sometimes .	3
You have a lot of faith in us !	6
Oh , he's the one who instigated this calamity !	0,6
You worked with [PERSON] , [PERSON] and them guys .	3
Because it is in love with her , clear .	3
You think of yourself and the one you're in love with .	3
We're all old friends .	3
I object .	0
If by the third count you and your officers are not on the way to work I will give the order to fire .	0
I just did that to torment you .	0
But , of course , she's lying .	1
This means [LOCATION] , for sure .	2
You'll see what man's carved out for himself after centuries of fighting for something better than jungle law .	3
He attacked your bitch .	0,1
It's a good thing I'm in music instead of comedy .	3
Take this and start a new life for yourself . Somewhere off this bus , okay ?	3,5
I was in that room !	0
You pull one thing , you're out .	0
Supposing I don't tell you ?	0
With the transit trouble , I didn't expect to see you on time .	6
Are you trying to kill me ?	2
Not my book , anyway .	0
You have not even taken off his shoes .	1
Are you sure it was there ?	6
Hey , don't worry !	3
It's not deep , but it's there .	3
I'm sick and tired of hearing about him .	1
The queue was endless .	5
So long , suckers !	1
Maybe they're buddies after all .	6
Maybe it's best I do remember .	2
That's not competitive . That's ambition and talent .	3,6
You got ta be joking . - I neverjoke about money .	0,6
I think you're incredible .	3
I've been doing some checking on you , Mr. [PERSON] .	2,6
Have a nice day .	3
I ain't aiming for you to go to [PERSON] ' and gobble like a hog !	1
If I use my last wish ...	3
There's gas coming out of the wing .	2
There's no way I can have this kind of exposure .	5,6
Another funeral for the pilot , not as spiffy as [PERSON]'s .	5
Cos whatever you got up there , I'm gonna find it out .	1
But you're going to be all right .	3
Are you saying you're insane ? Is that your defense ? - Plus she took a lot of prescription medicine .	0
I see them coming , baby I'm throwing myself in the fucking ocean !	2
Only to be met by this fresh and superior attitude of yours .	0,1
We're payin' 'em back , boy .	0
[PERSON] , look out for the Red Car !	2
Ah , thank you .	3
I've got to get out before he gets back !	2
The hair looks good .	3
There's too much loss of life and property damage possible .	1,5
Come on ! Come on ! - No !	0
She knew something .	6
It was a pleasure .	3
I offered the dough because I wanted to thank you .	3
I think that people would stop looking at each other with a certain level of hostility , like , we do now .	5
What are you thinking , Lieutenant , that I'm a coward ?	0
Yes , I'm talking about honour , not ideology .	0
Are you saying he's dead ? Not lying down dead , my friend .	2
Call it off , [PERSON] .	0
I don't feel very good .	1,2,5
Fuck him .	0
I don't understand it and I don't like it .	0
So , you'll work your way through all the gangsters ?	2
The director is not the problem . It's the insurance company . They won't cover you if you do drugs .	2,5
It's all bullshit .	1
Sorry , coach .	5
This is our song .	3
If this is an escape route , why didn't you escape long ago ?	6
Suspicious old goat .	1
I'll give you two .	3
We thought they might be weapons directed against us .	2
A bomb ?	2
Everybody calls you plain [PERSON] , why can't I ?	0
[PERSON]'s gonna kill me , [PERSON] .	2
I understand perfectly .	6
I know all the other teams laugh at me .	5
Knock it off . Will you knock it off ? !	0
How good to see you !	3
That name's kinda familiar , ain't it , Mink ?	6
The thing is , [PERSON] , we lost a little time .	2
Do you want to know everything ?	5
Of course , you know that the first thing is to fall in love .	3
I don't want to raise him by myself .	5,6
No , you don't know what it is .	0
[PERSON] , we have to go downstairs quickly !	0
So are you , but I admit it openly .	0
You don't care about me .	5
Well , I'd begun to feel that I didn't have any part in your life , that I was an outsider .	5
With ryan gosling . - This guy is here . - Yeah .	3
Years ago , when we still had executions in the state he used to volunteer as a witness .	1
They say some of us can turn as late as nine or ten , but I'm past that now so ...	3,5
[PERSON] , will you let me finish ?	0
[PERSON] , if you knew what I've gone through !	5
You should have thought of that before you left the house .	0
One !	6
We've got the perfect weapon , right over our heads .	3
A quarter of a million dollars ?	6
You don't care whether I live or die .	5
I suppose he just can't get over his wife's death .	5
They certainly want you to stay on . It's just , they felt when it came to head of department ...	2
What are you talkin' about ?	6
If I hadn't seen you on the news , I wouldn't have known who his partner was .	6
Nobody can do that , ... Except you .	3
You only pretended to be my friend .	5
Of course , but we are only telling you because we know you'll want to rescue him .	2
Look at [PERSON] go !	3
It was self - defence , for [PERSON]'s sake !	0
That seems to me like a darn short prayer for a sinner like Dude .	1
Nobody messes with the Healys !	0
When ? - Call came in last night .	2,6
I never thought I'd find myself in that crowd .	5
She was so fat , when she sat on a drugstore stool , she had a hangover .	1
I got a man here that sailed on the Golden Arrow And lived to tell about it .	6
I'm in bad shape .	5
Because I love only you .	3
They don't know themselves .	5,6
Oh ... okay , forget it .	5
That's all ?	6
Your Ma's in a coffin being eaten by worms .	0,1
Copycat !	0
You can't go down there !	6
I remember when I was years old . Mr. [PERSON] called me in for a meeting .	3
Old man , why are you carving my name ?	6
I think an apology ...	5
Up yours !	0,1
She's always in the bathroom !	0
Oh , no !	2,5
I don't want you on here right now .	0,1
He's dying .	5
And what makes you think that note would interest me ?	0
[PERSON] , she's dead .	5
You go find it .	0
All I could think of was that they were going to kill me .	2
Must be losing it .	1
Why do you look at me like that ?	2
You don't like jazz , pal ?	6
What the devil have you been up to ?	0
I saw it , but I didn't believe it .	6
I think it sucks . - What sucks .	0
But a little more of your stupid behavior and even the respectability of my house won't shield you .	1
Miss [PERSON] , I have discovered how to retard the ageing process .	3
He wasn't much of a man .	1
♪ For me and you ♪	3
These are my favourite toys . Who am I kidding ? They're my only toys .	3
I hope you get in trouble some day !	0
I wanted to apologize for the other night And I was wondering if I can have an opportunity To see you again today and -- and just talk .	1,5
Did you bring that guy in here ?	0
Touch me and I'll sue .	0,1
What should we do , moron ?	1
You see that man giving screwface to [PERSON] ?	1,5,6
We've got to get the money in circulation before you'll get this country back to prosperity .	2
What the fuck man ?	0
I hate you all .	0
He polluted their guts with language that shouldn't be inside of no man !	1
The fleet didn't order us to manoeuvre at discretion .	0,1
They were sailors , same as me ... Slaughtered by that monster You're tryin' to make friends with .	0,1
Damn you !	0
You certainly are !	0
He's good - looking .	3
m glad for you . 	3
I worry about you , that's all .	2
One , that I don't mess up as a manager .	2
It could have been a dead end .	2
I was amazed at his violent reaction until the evidence came to me that he owned those very 200 , acres .	6
Use my car . Great .	0,3
Unfortunately , Professor [PERSON] is dead .	5
What good is that gonna do if the people who run this government don't have access to the programs ?	0
[PERSON] ! Welcome back .	3
The odds against survival in this camp are even worse .	2
And you wouldn't want to endanger Mr. [PERSON] , would you ?	0,2
That's very gracious of you .	3,6
I don't understand why I was transferred to you .	0,5
Apparently any mother , even a bad one , is better than none .	1
They're not putting up the money .	0
Yeah , I sure feel sorry for you , [LOCATION] .	5
She can't stay off that kidney machine too long .	2
The service in this hotel is terrible !	1
[PERSON] said to tell the old man - I'm sorry , sir , the captain - that he'd better start thinking about a tow .	2
You listen to me .	0
When does he ever hear me swear ?	6
What's he got to do with this thing ?	0
So , you're a lawyer now ?	6
A depressing characteristic .	5
I mean ... except with you .	2
I tried my best to make a man out of him ... but it look like I failed somewhere .	5
Taste for fine things .	3
Where the hell is Special Weapons ?	0
From the bowels of hell ...	2
How thoughtful .	3
Somebody help me !	2
You run in the same circles .	1
Um , look , can we just forget last night ?	2
It could still come back at any time	2
What about ten commendations for valour and the best felony arrest record in the history of this department ?	0
I demand you stop this charade ! You ... Demand ?	0,6
Quite an act .	6
Somebody , help us .	2
I like him so much .	3,6
Don't touch that television !	0
They might take us for innocent bystanders .	2
Remember , when you invited me ?	6
I really like your singing .	3
[PERSON] , ain't you gonna do nothing ?	6
You have a resemblance to him .	6
That don't stop me from taking a saintly pleasure when I get a chance .	3
So I say , l don't know . 	5
What if I can't take it off ?	2
Better than yours .	0,1
Thank you . Good night .	3
You ought to be shown up .	0
I haven't the data yet .	5
I thought I'd lost the ability . With you , I. ...	3,6
It will get me in much trouble .  	2,5
Many hands went into creating [PERSON] .	3
Well , someone needs to stay here with [PERSON] and Bud just in case .	0,2
It's too depressing to think about .	5
Where is everybody ?	6
No , no , no . Shit .	0,1
You're a killer .	1
You've got to get there before sundown .	2
But , sir , when the job's done , who knows if we can return by this route or whether we could find you if we did ?	2
What about the big band I got to play ? Do you remember that ?	3
You get to be the mayor who cleaned up [LOCATION] .	3
They send me home a hero and I say wonderful things about them back in the [LOCATION] .	3
That's brilliant . [PERSON] .	3
Man , I always thought it was the mezcal talking , but after seeing this , I think he was right .	6
Except you honked the fucking horn .	0,1,6
Let's kill him now .	0,1
It's not negotiable , [PERSON] .	0
I shall dance , and you'll be with me .	3
They're poorly !	5
Make it a single , [PERSON] .	0
Let's drink to something .	3
gonna be some hard times coming down .	5
The bastard [PERSON] betrayed us	0,1,2
I have a car for you .	3
Why don't you keep out of this ?	0
I'll pay the ticket .	1
He'll be our child .	3
I was afraid of making a fool of myself .	2
Never !	0,1
Fine , till you come along .	0
Don't you think I know it ?	0
It's for my kind of money .	3
Thanks , little mate .	3
Hell , we could bring in the whole god damn New York Knicks just to make sure your trash hits the basket ! How's that ?	0
Morning . - Hey , babe !	3
You can still climb in that kiddie car and take a hike ... unless you can fight better than you can drive !	0,6
I'm sorry this had to happen , [PERSON] .	5
And just possibly , we will heal Some of our sickly , and / or ... Crippled followers .	3
Bring her .	0,1,2
[PERSON] , I'm disappointed in you . Hiding under a nest while [PERSON] needs help .	0,5
Intriguing young lady , Miss [PERSON] .	6
I'm not leaving this house today !	0
Barney ! [PERSON] , what a day .	6
It's cold .	1,5
This kid's taking this too good .	6
Listen , my folks is important people in [LOCATION] .	0
He reached out to us and asked if we'd be willing to help him	3
This ain't no poor farm .	0
Tries to make it look like rape .	1
I just want to have my shipyard .	0,5
If it were our plane , it'd be crashing .	0
You got me down in this goddamn water .	0
I don't believe it .	6
I don't think you should drive .	2
[PERSON] , it's perfect .	3
Nothing ever really dies in the House .	0
Divvy bitch !	0,1
Everyone sees this thing except me .	5
Violence prone , obsessive / compulsive personality , a history of excessive physical force throughout his years as a [LOCATION] police officer .	1
A guy who was a pain in the neck even before I carried his stuff .	0
What'd you mean ? Kissing that bitch ?	0
Yes , I was always afraid as a child .	5
That won't help you .	5
Over my dead body .	0
Bloomy , were you asleep ?	5
You know I've been in situations , where , like , I've been shot at . You realize that , right ?	0,5
I know you were deeply touched by [PERSON]'s gesture ,	3
Then why are you hanging around here ?	6
He is very talented .	3
Stop the car !	2
Come on , come on , don't drop it ...	2
Princess [PERSON] ! Come down !	2
The less the girl hears , the better .	2
I'll see you later , okay ?	3
I'm thinking about showing him and getting pregnant . Of course if I get pregnant I can't go to FATI .	3
That's how it works .	0,3
I can't take any more of it .	5
I don't know what it is	6
Looking for [PERSON] ?	3
It'll get cold .	2
If anyone had told me this morning that I'd decide to go to [LOCATION] ...	6
You son of a bitch !	0
I still insist he's paranoid .	1
Well , give me a coordinate !	0
God keep us , keep us all .	2
Why don't you  try it ? 	0
Standard opening . And now , you are being deliberately stupid .	0,1
Then the [PERSON] and everybody in it could be destroyed .	2
They're coming !	2
A captain's job is a lonely one .	5
It was nice of you to break your date .	3
Is this stupid thing What you're most concerned about this morning ?	0
This is a very sad day for me .	5
My name is [PERSON] .	3
Get in the drawing room , lock the door . Don't let anybody in . Don't answer for anybody , all right ?	2
Don't you see what's happening ? If you don't find me a killer , there is no fucking office !	0
I know that when there's something wrong , you tell me . But there's something going on that you won't let me understand .	0,2
Not your boychick , yeah ?	0,3
We have no choice .	1,5
What is not going to be easy ?	1,5,6
He'll keep us flying missions till we're all dead .	2
If [PERSON] sees a phone company subpoena , now , she'll bust a gut .	2
And I stormed out .	0
You've overlooked several other important details .	0
[PERSON] !	0,2,3,6
Call Dr [PERSON] .	2
Maybe you should have thought of that before you sent her to rob my client .	0,1
But there's the challenge .	2
I like the bubble . - Yeah ?	6
I hate this river .	0
Yeah , we got unfinished business ! Her and me .	0
Don't give up , [PERSON] !	3
I need to see you right away .	2,3
We are on an official mission ... and we have no right to change the orders of our superiors .	0
I just hate to hear you blaspheme .	1
Don't settle for less because you're a whole lot more than that . 	0
Pardon me , are you an explorer ?	6
We lost [PERSON] , go back !	5,6
Get out of my office .	0
Don't you dare turn that off !	0
You can't buy people's souls .	0,1
Is it for this that you hold me back from a raid on [LOCATION] ?	6
That kid's a monster !	1
The blood of [LOCATION] knows all truth .	3
What an idiot .	0
These are all my presents !	3
Is this [PERSON] , who we went to [LOCATION] with ?	6
Well , ain't that good ?	3
Then , you know you've got a shitty witness .	0,1
Help , I'm slipping !	2
As always in my life , everything begins with my family .	3
I am exhausted .	5
We don't want [PERSON] to come , the bald giant with stupid sunglasses , knocking everybody around for kicks .	1
God , what's our status ?	2
Mr. [PERSON] , I really appreciate all the work you do for him , but you and I know that my bloc is growing .	1
They are so beautiful .	3
Almost .	5
It takes away the pain .	5
Now that I've shot my face off , I'll give you the chance to do the same .	0,3
Well , what's there to talk about ?	0
Thank goodness you're all right .	3,6
It's a whole new deal .	6
So that at least narrows down where they are right now .	3
I promised myself when I get out of jail , I'm gonna find a Vago .	5
You have a very nice little boy , madame .	3
Put your heads down . Put your fucking heads down !	0,2
[PERSON] , I can't make it so soon ...	1,5
The killer is insane !	1
You want me to go in there ?	6
What's a girl to do when a man keeps following her around ?	2
I mean , if our system wasn't any good , why did they take us over in the first place , right ?	6
[PERSON] , you look very handsome in a tuxedo .	3
Yes , I noticed you'd packed .	5
Why don't you try to get some sleep now ? You're gonna need it .	3
He was nice .	3
Hsiao - tsing ? !	6
He was gonna die ?	2,5,6
Hey ! What's up ?	6
No , I don't need time ...	0,5
Oh , no ?	2,6
You one of them rare youths , yeah ?	6
Don't tell me that you're above temptation .	0
As am I . The black community deserves so much better than [PERSON]'s failed policies .	0,2
That's out of our jurisdiction , isn't it ?	1
Hey you saved my life , so stop crying , huh ?	3
Bye !	3
Yes .	3
Eat shit !	0
You're lying .	1
You'll be glad to hear that the lift was working this morning .	3
Bibbidi ... Bobbidi ... Boo .	3
Any decent church would've burnt you bastards years ago .	0,1
If I wanted to come in , no lock could keep me out .	0
Yeah , you might say that .	3,6
Wh ... what do you want me to do , pa ? Git another girl ?	2
No one can help me .	5
I said part of me  . 	0
Please be careful .	2
Anyone in your vicinity is in danger .	2
You want to know what a real criminal is , [PERSON] ?	0
Why did you choose Chipping Sodbury ? There is a convent there !	5,6
Oh , this place is such a mess .	1
[PERSON] , do you know what you did ?	1
It's [PERSON] ! [PERSON] from [LOCATION] .	3,6
I lied .	1,5
This was the most - watched event in the history of the National Press Club .	6
I love [LOCATION] on summer afternoons when everyone's away .	3
There he comes !	3,6
Someone's shown up to bail the city out .	6
We have a winner !	3
You wouldn't want me to go in with a blunt scalpel .	3
I do not want to hear one more insubordinate word ... from anyone in this platoon .	1
I can't stand this spic shit .	0,1
She kissed you ?	6
Okay , you guys , she fell for it .	3
What you got on me , Kid ?	0
Let's just worry about getting out of here .	2
Don't worry .	3
I'm glad for the company .	3
I am sorry .	5
They and the page boys are the only real class in the place .	1
If you ever had a sense of humor . When you finish testifying ,	0
I knew my ill - fitting clothes were unsuited to the exertions that lay before me .	2
Are you suggesting that I killed those women ?	2
You'll sell the furniture ?	0,6
He died a year later .	5
And listen , I want to thank you so much for helping us with this .	3
What you want ?	1
It's too dangerous , it's utterly unpredictable .	2
And I got so drunk I puked spaghetti everywhere .	6
What the hell's going on here ?	0,6
I loved your drawing .	3
It's hard , this fight .	5
Don't you look good .	3,6
You got ta be a real putz to wear a white coat around here .	1
Why did you do it , [PERSON] ?	6
Say , don't annoy me .	0
Oh , my God , we're being kidnapped .	2
We want you to rob drug transport .	0
You ain't learned yet who's running this show .	1
Fucking asshole . I love you .	3
You told me that when you overwork you get nervous and lose weight .	5
You disapprove , sir ?	5,6
How can you want me now I'm like this ?	2
But , they might be ready to make a go of it on their own .	3
What's your school counsellor wan na see me for ?	6
Get off your ass , get a job and get a fucking life .	0,1
I kept my mouth shut because I didn't want them to get in trouble .	5
I like to watch .	3
That's very rare .	6
Ah , ah , I'm so sorry . [PERSON] has nothing to do with this .	1,5
We're not running low , are we ?	2
I don't know what I may tell you .	2
Aren't you tired , [PERSON] ?	6
I won't live long .	5
Don't panic .	2
The Lady herself Inglethorp !	6
[PERSON] , she tore the fuckin' place apart .	1
So anyway , I wan na tell everybody that the flight over was really nice .	3
This is just plain suicide , sir .	2
Well , I don't give a damn about the reason .	0
Of course they're armed and dangerous .	0
Well , I'm sure things must have been difficult with your parents passing .	5
It should come to life for every boy .	3
Who would do something like this ?	0,6
It's because he's relentless .	0
Now that particular statement really pissed me off , because I don't think Congress did any such thing .	0,1
Don't Freud me , [PERSON] . You're not qualified .	0,1
These are the firearms we use .	2
Why [PERSON] , what are you doing here ?	6
What is with you ? What goes with you ?	0,1
I don't want this !	6
There . You see ? Someone else who knows that it's wrong .	2
They know everything now . I've explained everything to them .	3
You never wore that before .	6
Terrific .	3
I'm strong , snappy , loving .	3
You can't guarantee our luggage !	0
You think that's gonna fix it , huh ?	0
You folks have a nice trip .	3
[PERSON] was never supposed to talk to him .	0,1,5
This is where it all started for me .	3
Father [PERSON] told me that you had to keep your hands to yourself .	5,6
That's very inspirational , [PERSON] .	3
If you're saying what I'm thinking you're saying , you better not say it because I don't wan na hear it .	0
And you are the biggest liar of all !	1
That's the trouble with you .	0
It was wonderful .	3
Read what the critics say ... wonderful !	3
I'm waiting .	0
Case is here !	3,6
They both fell .	5
The are buried ... alive !	1
Mishnev is still dead .	5
That is the original invitation .	3
Back in the village when they made fun of you , I wanted to kill them .	0
Act your age !	1
Andromeda is very beautiful .	3
Sounds tough .	5
Mark , I was the one who had the worm . Thank you .	0
What kind ? Your tools are broken .	2,5
Girl of quality and taste .	3
First , take him to the station .	0
Before proceeding further , I'll remind the visitors in the gallery that they are here as our guests and should conduct themselves as such .	1
He's a male chauvinist .	1
What a character .	3
It's not so simple . What the hell isn't so simple ?	0
That's very rude , refusing to dance with [PERSON] .	1
♪ - Oh ! - ( Laughing )	3
That's very sporting of you .	3
He shouldn't have to decide here .	5
I see you're as adept at breaking into houses as you are into cars , [PERSON] .	1,6
I'm in the shithouse .	1
It is a crime that happens against children in every neighborhood , in every city and state in the country .	0,1,2
An honorary stooge like me against the Taylors and Paines , the machines and the lies .	1
Mint juleps always make me sing .	3
Well , good to see you boys made it through the war all right .	3
You said she was coming with us .	6
Yours will , depend on it . Because you're like all criminals , you're greedy .	1
He'd undergone a lot of strain .	5
My boy [PERSON] !	3
God , he is a tough old bird .	6
Even though we have each other . It can be a very lonely existence .	5
Just let my man shoot here , okay ? Just take it easy . $ on this .	0
Foo - foo is a good dog .	3
School's gonna be a problem for the kids .	2
Where exactly do you live ? Nowhere .	0
I'm telling you , it's gonna be all right .	3
Another dead end .	2
I can't do this anymore .	5
Do not .	5,6
Think them folks would spend a penny to send you east ?	1
I shoulda listened to you .	5
I would hate to commit myself without my compass .	5
Would you like me to go back and get [PERSON] out ?	6
Decker's been calling again .	0,3
I get pissed off , my wife gets embarrassed , the kids are confused .	5
We know next to nothing about them except we believe they're connected to the Hezbollah .	2
There's a lot too much going on .	0,5
Therefore , I'll always get laid more than you , which is fundamentally unjust , am I right ?	3
I'm telling you , sir , you've got to put a stop to him now .	2
The Kid will have to play him .	2
He's such a nut about that car and driving fast ...	2
Well , that was a personal matter .	0
The military has been mobilized , but the violence is so widespread that it is impossible for the rescue services to respond .	5
