You're not gonna have a country that can make these kinds of rules work , if you haven't got men who can tell human rights from a punch in the nose .	1
I don't want it .	0,1
That task force is headed this way .	2
Don't you find that kind of disturbing ?	1,2
[PERSON] , are you familiar with Article of Navy regulations ?	2
You've got to stop !	0,2
Let 'em have it !	0
So much fun and imagination .	3
[PERSON] , what happened ?	6
And m the tooth fairy . 	1
Well , I'm not people .	0,1
This is like the best thing I've ever eaten in my entire life . - It makes it yummy .	3,6
Bring her in later .	0,2
That's quite a knife you carry .	2
We're all gonna die .	2,5
You'll beat me but you'll go down , [PERSON] .	0,1,2
Oh , she did !	3,6
I'm so glad we stayed !	3
As he waves to the crowd , you can hear the tremendous cheer !	3
I don't think anything we can do would be of the slightest use .	5
Frank . The Benzedrine's got my teeth wiggling .	1
Dorcas , it brings me stamps , please .	0,1
I hadn't heard . I'm sorry .	5,6
Give us water !	2
Am I really good enough ?	2
God , it's in perfect shape .	3
You're not driving , are you ?	2
Hey , that's it .	3,6
June , your dog just upchucked .	1
Of course . Thank you .	3
[PERSON]'s loaded to her fingertips with love for you .	3
Tough shit !	0
You're crazy .	6
They're saying they're not responsible for what people put on their website .	0
He'll take orders all right .	0
He's such a little man .	0
We weren't trying to escape .	2
This train can't wait .	0
Hey .	3
Don't slouch .	0,1
Oh , [PERSON] , she was just great !	3
You can't .	0,2
I want these pots so shiny I can see my face in them !	3
Okay , well , it doesn't really matter now .	5
Well , tell Mrs. [PERSON] to get to the bottom of it somehow .	0
We have no choice but to use every conceivable weapon if they land .	2
There's still places I want to see and things I want to do .	5
Very good !	3
That's what you're always talking about , helping other people out !	0
So make them pay .	0
I'm a perfect surgeon .	3
That sounds swell , [PERSON] .	3
Bitch !	0,1
[PERSON] , open your fucking eyes !	0
Get upstairs , miss .	0
We mean it , sir , all kiddin' aside .	3,6
Whatever I lost , I lost a long time ago , and I don't plan on losing more .	0,5
I can't believe this is you , [PERSON] .	6
I can't make it tonight .	5
What are you doing here , [PERSON] ?	6
Out .	0
It felt good .	3
Lucito , huh ?	6
Incredible !	6
[PERSON] , I care about this woman .	3
Why did you lie to me ?	1
Isn't this the finest time ?	3
Oh , my gosh !	6
Hey , put the phone down !	0
Is Mommy going to be all right ?	2
You girls a bunch of nudists ? Or you just , uh , short of clothes ?	1
I told him my problem , I told him I loved you and he told me to keep my trap shut .	5
He likes the way his wife welcomes him home .	3
I don't want your tomatoes !	0
A lost decade , but it was worth it to make your father pay for my loss .	0
You see . we're not like you think we are .	5,6
But what's that thing in my back pocket .	2
And denied .	5
I hope you lose .	0,1
Which is fine , because you really never could have had me anyway .	3
Now , isn't that a charming invitation ?	3
Close your mouth , dear .	0
[PERSON] ! We're family !	6
Who the hell are you to ask all these questions ?	0
Don't be sure .	0,1
She was nothing ... nothing human .	2
You'll never deceive the people again !	0
It's rather funny .	3
Kind of reckless of you .	1
We came to love him .	3
That's what comes of teaching science by TV .	1,5,6
Everybody else thought it was funny !	6
Don't bother .	0
No , not tonight .	1
I suggest you keep that promise .	0,5
We didn't hear that .	2
And at the end of the happy day he is slaughtered jolly with a knife .	2,6
I Iove you , [PERSON] .	3
We've had wonderful times , we three .	3
When I first took a deal to become an undercover informant in a biker gang , I did it to save my own skin. ,	2
Oh , thank God .	3
Why would he buy a bible ?	6
See ? I might as well be in a Mother [PERSON] .	0
We don't -- we don't wan na do this but ...	2,5
Yeah , like what ?	0,6
I really don't care if you're the law or whatever the fuck you are .	0
Four minutes to bomb time .	2
What revenge ?	6
You think I have a chance at that ?	3
You don't have a boy !	0
We can use [PERSON]'s own plan for train robbery .	3
What happened to you ?	2,6
I thought you weren't a romantic .	6
How do I know you'll jump ?	2
Did you tell him what a great success it was ?	3
What do you mean , call ?	6
I would wear the same gown I wore when you were my favourite beau .	3
And you're shocked because I took credit for your idea .	0
He wanted me ,	2
Pray you get the chance .	2
Can't I do what I think is right ?	0,1,5
This is my life we're dealing with .	0,2
We're seven minutes behind schedule .	0
Mr. [PERSON] , you're playing with fire .	2
We're unbeatable .	3
You're not beginning that again , are you ?	6
Do I actually see this ?	6
Your skin stinks of it .	1
I hope he dies of pneumonia . - Did you see that shit ?	0
Everybody forgot about it but me .	0,1
I can grow another one in a week .	3
I'll invite [PERSON] to dinner Saturday .	3
Motherfucker .	0,1
There's going to be an awful lot of red faces if this policeman does his duty .	1
But I won't stand it any longer .	0
Now this is a fine thing .	3
I warn you , colonel if I am to die , others will die before me .	0
All that bread and livin' in a dump like this . Smashed cars , busted - out buses ... but all good stashes .	5
And , uh , I love to experience pleasure .	3
I don't see any native girls hungry for affection .	6
To be frank , they could be gone by Monday .	2,5
Most of their wounds won't heal properly .	2
Man , just look at him .	1,5
I think the least people could do is to say they're sorry , or ... something .	5
For a moment , I thought you were a man .	1
[PERSON] , what's the most recent communication we've received ?	2
I thought I was someone who I wasn't .	6
It's nice to have somebody to say goodbye to .	3
l'll bring [PERSON] and one other .	3
I'm not sure how much good all this talking's doing .	5
That gal's got you all messed up .	1
I'm going to [LOCATION] with a million bucks taped to my butt unless you keep screwing around , in which case , we'll all go to jail .	0,1,2
Smile .	3
Don't  Your Majesty  me !	0
Yeah , yeah , yeah ...	0,1
How do you know ?	2,6
A woman who drinks is bad enough and I will not stand for a woman cursing and blaspheming God .	0,1
I don't think I should join your campaign , you know .	5
Yes sir , the thrill of the open road .	3
As I told you , it's time we did something about it .	0
Did ya ? There was a razorback in my truck !	0
It is completely well now , mother .	3
Breaking my heart with your impossible love !	5
You're a trained killer !	1
There's a certain amount of hurry up involved here . My life is in danger . Three ten .	2
There ! I got it .	3,6
I am a swan !	3
It's not mine , man .	2
No ?	0
Look , there's something weird going on here , and I can't quite follow it .	2
Don't let that cop get away with this .	0,1
