So I guess growing up in the wetback section of [LOCATION] wasn't that bad .	3
We were wandering around , that's how we got robbed .	2
Well , he'd better be if he's gonna remain anything at all .	0
The girl escaped ... the other one and my son are looking for her .	0,2,5
But there's nothing for me to do after 3:00 .	5
[PERSON] , why don't you just ... Lighten up .	0
Diamonds in your hair , rubies on your fingers .	3
Don't shoot !	2
Let's get out of here !	2
I have a kid . I have a kid . - Hmm ?	2,5
All I ask of you is be careful .	2
Get back .	2
Say , I understand those Mexican señoritas are still pretty as ever down there .	3
If I go , you'll ruin me .	2
Not a care in the world .	3
I didn't mean to offend you . I was just being me , you know ?	2,5
I've got a headache , [PERSON] .	5
I'm going to need you to put your hands up .	0,5
Y' all take care now , you hear ?	2
You're so dumb , you don't know you're alive .	1
Yes , I do . - No , you can't !	0,1
I don't like being pushed around .	0
It's me , you fool .	0,1,3
Your whole story about how [PERSON] got his name on the door is bullshit !	0,1
Terrific , great , incredible	3
What about staying alive !	2,6
Oh my God ! You guys are all a bunch of freaks .	6
Wonderful , my dear fellow .	3
I told him you guys wanted out as well .	2
I find myself quite interesting , really .	3
Ensign [PERSON] called and told me that you were in trouble .	0,6
What the hell are you doing ? - [PERSON] !	0,6
I know now that you're a man who employs business methods ... which in [LOCATION] would be punished by death .	1
We thought Monsignor [PERSON] will take over the building fund .	6
It's a road trip and a party rolled into one .	3
That's wonderful , darling .	3
Of course I'm sweating , you moron .	1
I'm impressed .	6
I'll still be alive , when you're all dead !	0
So , we have bought a little time to locate [PERSON] .	3
I try to help , but he doesn't listen to me , and I've got my own grief to work through .	5
No thanks .	0
I know that you need help , I know that I'm in no position to give it to you , - so , as your friend ...	5
Hi ! - Woman : How are you ?	3,6
Food goes down easier .	3
Find the most tender and vulnerable , to destroy his heart .	0
But they actually had a very thin but tight fitting suit on .	5,6
I'll be fine .	3,5
Well , nobody asked you to .	0
I'm not interested in what you think .	0
The things we have to do in these heathen countries . There must be an easier way to set a trap !	0,1
I don't want any more of it .	0,1
[PERSON] , turn me in if you want to . But this is over the line .	0
Love you .	3
I was a friend of the Human Beings until they stole my wife .	1
I just hate to see a good man go to waste .	5
No ! A lovely ladies ' purse .	3
Don't be rummaging through my private documents , [PERSON] .	0
I haven't been , uh , entirely honest With you , and , uh ...	2
The doc just looked at us and shook his head .	5
I've been sleeping with women .	3
So , what can I do for you ?	6
It was utter chaos .	5
Well , duty calls .	5
Our ratings have gone up .	3
Where do you get those wonderful toys ?	3
Right now !	0
There are definitely people who feel like it's your fault .	0
I'd have to kill myself .	2
I've , uh , really enjoyed this little chat .	2
Go on boy !	3
Help us .	2,3
You can't leave me here alone .	6
It's more than my job's worth !	0,6
[PERSON] , we've got a serious problem .	2
Look at me , I'm free !	3
Hey there , little buddy .	3
He's wonderful .	3
You've got to be realistic .	0
A wonderful day , I think .	3
Since he found out we're behind it , he's been running us ragged .	2
Uh , something like that , yes .	6
And isaac started flying up To the sad broken star .	5
He's starting to ... He's starting to ...	2
It is he .	2
Even so drunk , your brain is the greatest this side the [LOCATION] .	1
I hardly consider it fortunate to be bought by anyone by the name of [PERSON] .	1
Why don't you leave me alone when I'm sleeping ?	0
Won't admit that it exists .	5,6
Now you're going to fuckin' die .	0,1
Sure .	3
I'm pleased to meet you .	3
You're just being used , you know .	5
[PERSON] . [PERSON] , what happened ?	2
She passed her genes down to you in all the right places .	3
What about the horses and the cattle ?	6
She's empty .	6
Old man , my last name isn't Chow !	0
No man is gonna make a liar out of me , sir .	0
It's [PERSON] . I wanted to let you know - [PERSON] is set for tonight .	5
Hi .	3
Christ ! We've got no alternative .	0
Today's my birthday .	3
You're probably wondering why I'm here .	6
And whoever holds [LOCATION] points a dagger at the heart of [LOCATION] .	0
[PERSON] , can you hear me ?	2
She doesn't know .	5
If you discount the angina , the migraines and the gastritis , there's nothing wrong with me .	1
How do you know there was a murder ?	2
She was precocious , nosy , opinionated .	1
We come from a good family My name is Windy	3
How may times do I have to tell you ?	0
I'm not interested in anything you have to say .	0
That might not be the worst of it .	2
This looks good .	3
We're gonna end you ...  And all this ... 	0
That just can't be .	5,6
Wasn't that wonderful ?	3
Ooh ... Well , we almost had it there for a second ,	2
It's urgent !	2
This has been a terrible shock to them .	5
Trying to eliminate the human perverts .	1
And actresses are treated like I hate to use the word , but , shit .	0,1,2,5
I know how this city degrades the individual .	1,5
Hail , fellowship !	3
Yeah !	3,6
You surprise me , Mr. [PERSON] .	6
You don't realise what a plum you are for us .	3
I couId vomit .	1,6
No ! I don't know [PERSON] , I swear .	2
He looked nice .	3
Weak , a go - alonger , no character !	1
It's her !	2,3,6
They've done pretty well by you .	3
Just like we're gonna find a big hunk of that long green .	3
There's plenty of Nuke to go around .	2
It was fine . You've been away all this time ?	6
Lots of votes taken , but nothing has happened .	0,1,5
I will . This isn't exactly comfortable for me . I know you wanted this job .	5
Well , screw the British .	0,1
I am afraid of murder .	2
Come on , I'm old enough to be your father .	0
He's selling drugs around upstairs , and he's got the rest of them locked up down here without any rights .	0
A lot of you incumbents will be in danger of losing your seats .	0
If I spoke , you barely answered .	5
Heaven knows how she lived through those weeks .	5
She's pregnant ?	6
We already know that	0
What a welcome !	3,6
It is [PERSON] , the High Priest , who is filthy in his ways .	1
Who is there ?	2
Her cunt .	1
I - I know , I know .	0
Don't walk away from me .	0
I can't remember . - You can't remember ?	6
I just ...	2
Tell her we're waiting .	0
Splendid , thank you , sir .	3
The whole world sucks .	1,5
That's not gonna happen .	0,1
All my powers have gone .	5
They took the one with the collar ?	0,2,5,6
I was just trying to tidy up .	0
Pretty good chow .	3
You don't even know him !	6
I don't want to part with it even in death	0,1
I do not know what to do .	2
Any of you guys call me [PERSON] , and I'll kill you .	0
Hey , look who's here !	6
Is that so far from your desire ?	6
What's that got to do with it ?	6
He's a sneaky little shit just like you , right ?	1
You were married .	6
I'm glad to see you're all right .	3
What kind of a deal is this ?	0
Please ...	2
Out ! Get out !	0,1,2
There's nothing more commercial than a long - shot comeback of a down - on - his - luck underdog .	0,1
These images will pollute us .	1
If I catch any of you guys in my stuff , I'll kill you .	1
You pretend to raise money for the little league , and the whole community should lighten up ?	0,1
That's [PERSON]'s , he values that . He won it ! Good !	3,6
Rushing home to a hot apartment to listen to the automatic laundry and the electric dishwasher and the garbage disposal and the nagging wife .	1
I wouldn't laugh if I were you .	0
He was in terrific condition .	3
Will you shut up ?	0
That's rude .	1
Now neither one of you are making sense .	6
I'm not sure how to operate that thing .	2
That was incredible .	3
Until along comes a coward with a bomb .	0
I got a run of three .	3
Can't they find him ?	2
It's Nobel Prize juice . Set sail for home , for [LOCATION] !	3
Come on , the tougher the competition , the better you used to like it .	3
We're going on a big ship across the ocean and take you home .	3
Shut up ! And take those dresses off !	0
That high is not the one you're looking for . Believe me .	1,5
You came up here to kill me , didn't you ?	2
Take your mind off my work .	1
I am the medical examiner and the chief pathologist in the city , and they've cut me out .	0
It is you whom I love , much more than this .	3
We tried that route , but we gave up .	5
I thought he was kidding .	6
I ain't gonna be a nobody .	0
Oh , boundless heaven and earth Help me !	2
And lock your doors while you're driving , Because there is no telling what kind of hustlers Can come up to your car .	2
All right , what's happenin' out there ?	2
It's real nice , you know .	3
You're jealous that I have [PERSON] , and you've come to take it from me .	0,2,5
Shit .	0,5,6
Don't leave me here , please !	2
When I came here , I thought this was gonna be a 30 - day stretch , maybe 60 .	6
You're a liar !	0
How come there is no fire in the room ?	2,6
What you're dealing with is over your head .	0
Please help us .	2
Come on , you flabby old goat , give it to me .	1
Now , let's get back to our examination . Shall we ?	0
It's like spending a weekend in [LOCATION] .	3
It wasn't worth it .	0
I didn't know anybody was going to be killed .	2
Leave your celery .	0
I want hugs . - Morning hugs .	3
Fine ! But I'm not making a speech .	0,2
She was very nervous when we left [LOCATION] .	5
Why not believe me ?	0
Who was so interested ?	6
Why are you laughing ?	0,6
I want you to look how the moonlight cuts through the trees .	3
I'm not getting any younger !	2
I can't handle basic training again , man .	5
You better start reforming , [PERSON] .	0
That's very good .	3
I saw an ad for a young lady that looked like she could have been or at least once a week .	5
Looks like he's in great shape , don't he ?	6
And congratulations . I heard you're going to replace Mr. [PERSON] .	3
I'll be sorry to leave Faith .	5
Catholic school . A little minor league ball , long enough to find out I couldn't hit a curve .	5
The trouble is , a lot of highly paid favourite sons are in danger of having their rice bowls broken and going hungry , all on account of these goddamn notebooks .	0,2
He's a bit soft that Inspector , isn't he ?	6
Stay back !	0,2
When did this relationship take place between [PERSON] and [PERSON] ?	1,6
I just hope there's no snakes round here .	2
Then ... they actually expect you to go to work .	1
Mayii : I had long since lost track Of the child [PERSON] .	5
That's when they come . That's why they're called surprises .	3,6
Outstanding !	6
You couldn't have timed it better .	3
I'll take my chances .	3
Excuse me ?	6
Don't bother about me .	5
Stand by to torpedo !	0
And he calls me an asshole !	1
How is she ?	2,5
Be happy in your work .	3
Don't cry , honey .	5
You'll never mean anything but misery to any man .	1
I'm gonna speak to your ma !	0
These can be disposed of only by incapacitating the brain .	2
That's why you're getting older and she's getting younger !	0
You big fool !	1
It sometimes never goes away . How you talk .	5
I shall miss you too .	5
I would have sent it to you , but I didn't know your address until today .	5
She wasn't even there .	0
This thing isn't here for decoration .	0
The Beauty queen [PERSON] ?	0,1
He was ... fine .	1
Giants !	6
She's upset about something .	5
How'd they know you were on this train ?	6
You have destroyed our refuge .	0,5
Strange man .	1
You a fifty - dollar whore ? - What are you doing ?	1
Not a happy one .	5
[PERSON] , I'm not an idiot and I don't appreciate being treated like one .	0
You got bird shit in your hair .	1
You must love that guy to do what you did for him .	6
A whole new life with a family that values what you are .	3
Pa's no killer !	0,2,5,6
I think we're being set up .	2
That's why you have to have faith . If it made sense , it wouldn't have to be a religion , would it ?	3
Don't mind them .	0,3
Opening night never starts on time .	5,6
You're a disgrace to your country !	1
Now try winning a game for a change !	0
No , Dad , we adopted .	5,6
l 'm in love with a cop from the . 	3
How do I undo the spell ?	2
Are you following me ?	2
You're gonna be outta work , you keep scamming like you are .	1
My club ? Really ?	3,6
She did what ?	6
Excuse me your highnesses , but you're going to be late , And this restaurant recipe begs to order .	2
Women just love single male parents .	6
I appreciate it .	3
They had ...	5
Then stop calling me .	0,1
Charlie , have you thought how horrible it must have been ?	5
Well , my mother was a music teacher and married my father , whose family was extremely wealthy .	3
C'mon [PERSON] , hurry !	0
Aw . What happened ?	5,6
Your parents'll kill me .	2
You're beginning to realize maybe the public knows more about public relations than you do .	3
Stay with my mother ?	0,1
I don't trust them any more .	0,5
I'm sorry , I just made a mistake .	2,5
You tell these men and Senator [PERSON] what to do ?	6
Are you abandoning the search ?	6
You had me scared for a minute .	2
I wanted to let you know that the ambulance was late in getting away .	5
I was just calling because I'm having a game night .	6
According to some estimates we can not track . trillion dollars in transactions .	1
Move and I'll slit your throat !	0
I'm busy as the devil !	0
I got him sold , [PERSON] .	3
I will protect you .	2,3
[PERSON] , don't .	0
Isn't it marvellous ?	3
And you agree ?	0,1
Bring my gun when you come back !	0
This is an unscheduled surprise .	6
Heavens , no !	2
I apologise for his appointment .	5
You made a mistake I'm not [PERSON] !	2,6
You made the appointment without me .	0
No , no , they don't .	0,6
I can't take any more of this .	1,2
Be nice to that girl .	0
That's a weapon in your world ?	6
Sure , but that's good , too .	3
I would like to proudly present the newest member of the [PERSON] family , [PERSON] !	3,6
You're beautiful .	3
So , a rose is not a rose , and an umbrella has nothing to do with rain .	6
Get your ass movin' !	0
That surprises me .	6
It's a very rich life , And I do have a job ,	3
Eat your breakfast and forget it .	0
You see , they ask a lot of dumb questions about what it's like being a black policeman . Shit like that .	0
Casualty report ?	5
He's not coming back .	2,5
I got it , but I don't know .	5
I miss the time when I had you to myself every day .	5
It's a new car .	6
Now tell me you're glad to see me .	3
I love this car .	3,6
I don't want any locked doors between me and him .	5
If you don't eat and sleep , you have to expect accidents like that .	5
Yeah . Too good .	2
Okay , I'm with you .	3
It's a matter of life and death !	0,2
Twenty - four , maybe even twenty - five years .	2,5
That's a fine idea , Mr. [PERSON] .	3
Back in , I thought I had it made .	6
Yes , it was wonderful .	3
She was wearing them tonight .	6
Who is this delivery from ?	6
There's nothing we can do .	5
Howdy's got worms .	1,5
Where are the females ?	6
I don't want to go to [LOCATION] .	5
You keep avoiding me .	5
You're running the risk of harming your children .	2
Get out of there !	2
Hey , [PERSON] , while you're down there trying to figure out the female race ... you might as well take a bath .	1
They're nice .	3
It must be a mistake , he was clever ...	5,6
You can get brave any time you feel like it .	3
But , you see , it's really his wife that's keeping them apart .	5
Sure , [PERSON] .	3
You're really the tolerant type , [PERSON] !	6
No , not today .	0,1
Who wears a thing like that ?	6
A light beer with a twist for my friend .	3
For God's sake , shut that up !	0
You go ahead and let the grieving process happen .	5
Let me decide what to do with it .	0
Let's keep this a perfect memory ... and someday this bitter ache shall pass , my sweet .	5
Of course . You're a big supporter of my opponent .	0,1
Altitude ? - Altitude . You want some altitude ?	0
Strange that I should be called a destitute woman when I have all these riches locked in my heart .	1
It's just not that cute anymore .	0
You little bastard .	0
They're watching us .	2
Thank you , Mr. [PERSON] .	3
Besides , I really do repent . Really .	1
Erm ... I was just coming to that .	1
Yeah , he's alive and well and living in [LOCATION] .	3
All I got is what you see here .	5
You are wrong , [PERSON] .	0
You mind your own business .	0
You're in great danger .	2
Madame is canceling the engagement ?	6
( isaac crying ) - it's cranky time .	2
You're sure of that , are you ?	6
It's too stupid . Perhaps .	5
That huge place over there ?	6
I can't keep this from the president any longer .	2,5
You can't see him because you're not dead yet .	0
Are you still here ?	1
That night , we went dancing .	3
So me and my partner bolt up the stairs , somebody is screaming bloody murder ...	2
I. . . I can't .	2,5
You scare the hell out of me too .	2
That's a dream worth living for .	3
I'm tired of this baby crap !	1
You're wanted in Plot .	6
Save us digging new ones .	3
But these are criminals .	6
I'll kill you all !	2
[PERSON] gave me my title shot , you didn't .	0,5
Every day , you give this azupep a dollar for sweeping our sidewalk .	1
He's a prick .	0,1
Do not lie to me , [PERSON] .	0
You're right . I don't have to come , but I wan na tell you something .	2
Who's that ?	2,6
He's quite right . There's nothing wrong with eating dog .	3,6
If you ask you're going to get an absolute no .	0
My [PERSON] is dead .	5
Your parents have been calling all day long .	0
How much longer do we have to wait ?	0,1
Now , get !	3
My life is none of your business .	0,1
You don't get it , do you ?	0,1
You saw that coming , did you ?	0,6
What did he bring his pigeons for ?	6
Have a drink with the unwashed .	1
Hey , you can't talk to me like that .	0
And those working in the [LOCATION] Project developing the atom bomb were told that any secrets that they disclose would result in ten years in prison , or an equivalent of a $ , fine .	1,5
I will not be one mind with you !	0
I don't know if I can afford it .	5
That might be enough to win this race .	3
Hey , you know me .	3
Some loser gets a crush on you , you could throw him in the river , tie him to a piano and he'd come back faster than a dog with a bone .	0,1
Peaceful up here , in't it ?	3
Why don't you just go ?	5,6
I hate jumping out of a perfectly good airplane .	0
Give me the lighter .	0
Is she the one in the painting ?	6
You were supposed to come Tuesday .	0,5,6
Go home .	0,1
She just had a real spice for life .	3
Well , what do I care .	0,5
I can not begin to tell you how sorry I am ... That any of this has taken place .	5
Since I'm a one - man show around here , I think I'll forgive myself this one time ...	5
Oh , you're just exactly the same .	0
My argument with [PERSON] had nothing to do with any sudden realization .	0
What should I be afraid ?	2,6
I love a coward !	3
$ million , man .	3
With all the contributions of the Sea Hawks ... we can not possibly match [PERSON]'s vast resources .	2
Let's get him !	0
Why don't you go back and play hero in your own world , Earthling ?	1
Is it that you don't trust me ? No !	0
When were you going to give the money to the community ?	0
I can't take responsibility for this .	2
We just have to find someone else with more sense .	1
All the poor young girls .	5
I thought you said something .	6
[PERSON] , I'm gonna kill you , you murdering son of a bitch !	1
How's it taste ?	6
Get outta here , you goddamn parasite .	1
When he held me , it wasn't the way a father should hold a daughter .	5
No , not , [PERSON] .	5,6
Except we're not behind schedule , we're ahead of it .	3
You never stood a chance .	0
That night was the happiest night I ever had .	3
Hop on , no time to lose .	3
What kind of a girl are you , anyway ?	6
I have no idea what to do .	5
Then , you have to go .	5
You'll never be sorry .	0,5
How fortunate we are to have [PERSON] with us .	3
I saw it coming , but what could I do ?	5
So , congratulations , Admiral [PERSON] .	3
Help ! - Hello ...	2
I'm going to take you and buy you a drink .	3
You will pay me back .	0
They all coldcocked me .	0,5
I'll tell you why I'm calling .	0
And what does he want ?	0
This was my bedroom .	5
Look , sir , we haven't much time .	2
You're making me look bad .	0,5
Will you get out of here !	0
Louder !	0
I like your tailor .	3
No diapers ?	6
You're funny .	3
Come on ! You're gonna break your guitar . Come on .	0,1,2
Who , in your high school , has become homosexual or is deep into drugs ?	1
Stay with me .	2,5
You're the most beautiful person I ever met .	3
One good thing .	3
Somebody must be in good humour .	3
I wish I were a woman of 36 , dressed in black satin with a string of pearls .	5
Oh , very nice .	3
She'll kill you ! She killed him !	2
Why , [PERSON] , what a thing to say !	1
Things were going wonderfully well .	3
Well , that's very thoughtful of you .	3
Mrs [PERSON] , do you know what you just ordered ?	6
[PERSON] , don't press it this time .	0
A little restraint ?	0
I told you not to pick up the phone .	0
Come on , don't be a fool .	1
I triangulated her cell .	3
She'll listen to you , you're not her mother .	3
Calm down , chica . She only owes me more .	6
Who in the hell you looking for ?	0
We're going around in circles .	0
That butcher , Eggers , he'll take 35 , head ... and butcher them himself .	2
Grab the hand rail !	6
Since he escaped , residents of the bordering states have been afraid to leave their home .	2
Very funny .	3
I want to help out people that I like .	3
Well , she's fine .	3
Hello , [PERSON] .	3,6
I only saw her when the family rented a farm in the summer .	5
[PERSON]'s out of his mind .	2
Are you all right ?	2
What happened ? Where are the others ?	6
Caught in the act .	6
[PERSON] put me onto this .	2
Well , I didn't have the money .	5
Oh , him and his wife splitting up ?	5
You get your belly full of food , and you're a lover .	3
Of course . That's it .	3
I'm sorry .	0,1,2,5
And you believe that ?	6
Hello , sweetheart !	3
Did it ever occur to you , [PERSON] , that the prince looked everywhere for [PERSON] just so that he could put the shoe back on her foot ?	0
Oh , [PERSON] , I'm frightened .	2
What's your problem , jerk off ?	1
A whale can jump up like an earthquake and come down on you like a mountain that somehow put to sea .	2
No , no . - No interference from us , right ?	1
Why is there a statue of a husky ?	6
Almighty Sir ... do not drop us in the claws of the eternal death ...	2
Okay ? - We're not dead yet ?	2,6
A couple months in solitary will cool you off , bugger .	1
Same place you left your table manners ?	1
It's too bad .	1,5
I'm really not sure .	5,6
Here's to bigger and better dopes .	3
Don't .	2,5
He'd punch on my mother , too .	0,1,2
Well we're looking at major indictments , sir .	2
I wonder what he's got against the marines ?	6
Do not talk about that son of a bitch .	0
Hey , you two with the mileage upgrades , sit down .	0
It could break us financially .	2,5
That Miss [PERSON] is about the prettiest girl I ever did see .	3
It would be a pity if you died , not me	5
Let's stop wasting time .	0
Sucker !	1
Sir , you have beaten my wife , and she has gone off with another man .	0
They haven't even been touched !	6
Well , it's a shitty world .	1
For chrissake , where did she come up with [PERSON] ?	0
It's not a matter I want to discuss , I tell you .	0
I can't believe it myself .	6
I ain't giving you shit . I said I'd play you even , I play you even .	0
Well , he was old enough to be your father .	1
On the way home we did loop - the - loops so that I could see the moon upside down .	3
We're not winning this war .	2
There is something strange about that boy !	6
This is all I'm capable of right now .	5
I'm gonna kill them .	0
No , I don't guess it is .	6
Well , like I said , right now , I've got a bigger problem .	5
You're really gonna like the way Adrian cooks .	3
You , too , think I am too old , too ugly for a man to look upon with love .	5
We can't just leave him here .	5
Oh , no , Mom . I have to get up early .	1
Well , I don't want it .	0
This is so goddamn boring !	0
Senator [PERSON] , I'm pleased you could make it .	3
Look , if you don't want me in your Army , kick me out ... but get off my back .	0
Disappear .	1
You ever heard of the Vagos ?	2
We have to drop the case .	5
I just don't fit behind a desk , I I'm not cut out for it , I feel dry - docked .	1,5
You see what he did to Miss [PERSON]'s shirt ?	0,1,5
I just love it when it's so nice and warm .	3
Stop . Stop .	2
You gave a stranger who happens to mention my name the keys to our house ?	1
Well ... L - l - listen ! Don't say anything to [PERSON] about this , all right ?	2
I'm paralysed with happiness !	3
Just a walk in the park .	3
Not exactly funny , it's just that you're so different from your son .	6
Yeah , he's right , we got to keep moving , [PERSON] .	2
There's something , and if I'm right , I think I've solved a murder .	3
Before you know it , we'll be good again .	3
Somebody moved it .	0
Why should I give a crap ?	0
Weren't you reprimanding a seaman for having his shirt - tail out . - - While the ship turned degrees ?	0,1
I'm behaving like years old .	1
Run , [PERSON] !	2
House of Abercrombie and [PERSON] , publishers , drunk or sober .	0,1
Yeah , yeah , I got the horse all picked out to buy the ... we actually reached this turn in the road .	0
You can't do this ...	0
The Hundjager I killed was Verrat .	3
You and [PERSON] just weren't right for each other .	5
This is United States Navy helo approaching your position .	2
I don't like no one .	1
You know , I still expect him to come home for dinner .	5
It's not your fault the plane landed in [LOCATION] .	5
Enough to spread you out like a crazy woman's quilt .	1
He thinks the world of me .	3
[PERSON] , don't you remember ?	6
